{
  "schema_version": "completion-example.v1",
  "example_id": "ex-001",
  "dataset_id": "commander-completion-v1-fixture",
  "split": "validation",
  "deck_id": "fixture-deck-001",
  "ruleset_version": "commander-2026-02-09",
  "card_snapshot_id": "cards-2026-08-10",
  "command_zone": [
    "11111111-1111-4111-8111-111111111111"
  ],
  "visible_cards": [
    "22222222-2222-4222-8222-222222222222",
    "33333333-3333-4333-8333-333333333333"
  ],
  "positive_cards": [
    "44444444-4444-4444-8444-444444444444"
  ],
  "mask_strategy": "late_build",
  "mask_seed": 1729,
  "candidate_pool_manifest_id": "pool-001",
  "sample_weight": 1.0,
  "profile": "casual",
  "observed_at": "2026-08-10T18:00:00Z"
}
